{
  "$schema": "https://json-schema.org/draft/2020-12/schema",
  "type": "object",
  "properties": {
    "schema_version": {
      "enum": [
        "1.0.0"
      ]
    },
    "family": {
      "enum": [
        "F01",
        "F02",
        "F03",
        "F04",
        "F05",
        "F06",
        "F07",
        "F08",
        "F09",
        "F10"
      ]
    },
    "structural_level": {
      "enum": [
        "L1",
        "L2",
        "L3",
        "L4"
      ]
    },
    "features": {
      "type": "array",
      "items": {
        "type": "string",
        "minLength": 1
      },
      "uniqueItems": true
    },
    "periods": {
      "type": "integer",
      "minimum": 1,
      "maximum": 1000000000
    },
    "units": {
      "type": "object",
      "properties": {
        "quantity": {
          "enum": [
            "item"
          ]
        },
        "currency": {
          "enum": [
            "cent"
          ]
        },
        "time": {
          "enum": [
            "period"
          ]
        },
        "capacity": {
          "enum": [
            "volume_unit"
          ]
        },
        "truck": {
          "enum": [
            "truck"
          ]
        },
        "production": {
          "enum": [
            "batch"
          ]
        }
      },
      "required": [
        "quantity",
        "currency",
        "time",
        "capacity",
        "truck",
        "production"
      ],
      "additionalProperties": false
    },
    "products": {
      "type": "array",
      "items": {
        "type": "object",
        "properties": {
          "id": {
            "type": "string",
            "pattern": "^[A-Za-z][A-Za-z0-9_]*$"
          },
          "volume": {
            "type": "integer",
            "minimum": 1,
            "maximum": 1000000000
          },
          "shelf_life": {
            "anyOf": [
              {
                "type": "integer",
                "minimum": 1,
                "maximum": 1000000000
              },
              {
                "type": "null"
              }
            ]
          },
          "holding_cost": {
            "type": "integer",
            "minimum": 0,
            "maximum": 1000000000
          },
          "disposal_cost": {
            "type": "integer",
            "minimum": 0,
            "maximum": 1000000000
          }
        },
        "required": [
          "id",
          "volume",
          "shelf_life",
          "holding_cost",
          "disposal_cost"
        ],
        "additionalProperties": false
      },
      "minItems": 1
    },
    "locations": {
      "type": "array",
      "items": {
        "type": "object",
        "properties": {
          "id": {
            "type": "string",
            "pattern": "^[A-Za-z][A-Za-z0-9_]*$"
          },
          "role": {
            "enum": [
              "warehouse",
              "supplier",
              "hub",
              "market",
              "plant"
            ]
          },
          "storage_capacity": {
            "type": "integer",
            "minimum": 0,
            "maximum": 1000000000
          },
          "throughput_capacity": {
            "type": "integer",
            "minimum": 0,
            "maximum": 1000000000
          },
          "opening_cost": {
            "type": "integer",
            "minimum": 0,
            "maximum": 1000000000
          }
        },
        "required": [
          "id",
          "role",
          "storage_capacity",
          "throughput_capacity",
          "opening_cost"
        ],
        "additionalProperties": false
      },
      "minItems": 1
    },
    "initial_stock": {
      "type": "array",
      "items": {
        "type": "object",
        "properties": {
          "node": {
            "type": "string",
            "pattern": "^[A-Za-z][A-Za-z0-9_]*$"
          },
          "product": {
            "type": "string",
            "pattern": "^[A-Za-z][A-Za-z0-9_]*$"
          },
          "age": {
            "type": "integer",
            "minimum": 0,
            "maximum": 1000000000
          },
          "quantity": {
            "type": "integer",
            "minimum": 0,
            "maximum": 1000000000
          }
        },
        "required": [
          "node",
          "product",
          "age",
          "quantity"
        ],
        "additionalProperties": false
      }
    },
    "demands": {
      "type": "array",
      "items": {
        "type": "object",
        "properties": {
          "node": {
            "type": "string",
            "pattern": "^[A-Za-z][A-Za-z0-9_]*$"
          },
          "product": {
            "type": "string",
            "pattern": "^[A-Za-z][A-Za-z0-9_]*$"
          },
          "period": {
            "type": "integer",
            "minimum": 0,
            "maximum": 1000000000
          },
          "quantity": {
            "type": "integer",
            "minimum": 1,
            "maximum": 1000000000
          }
        },
        "required": [
          "node",
          "product",
          "period",
          "quantity"
        ],
        "additionalProperties": false
      },
      "minItems": 1
    },
    "routes": {
      "type": "array",
      "items": {
        "type": "object",
        "properties": {
          "id": {
            "type": "string",
            "pattern": "^[A-Za-z][A-Za-z0-9_]*$"
          },
          "source": {
            "type": "string",
            "pattern": "^[A-Za-z][A-Za-z0-9_]*$"
          },
          "destination": {
            "type": "string",
            "pattern": "^[A-Za-z][A-Za-z0-9_]*$"
          },
          "products": {
            "type": "array",
            "items": {
              "type": "string",
              "pattern": "^[A-Za-z][A-Za-z0-9_]*$"
            },
            "uniqueItems": true
          },
          "lead_time": {
            "type": "integer",
            "minimum": 0,
            "maximum": 1000000000
          },
          "capacity": {
            "type": "integer",
            "minimum": 0,
            "maximum": 1000000000
          },
          "unit_cost": {
            "type": "integer",
            "minimum": 0,
            "maximum": 1000000000
          },
          "fixed_cost": {
            "type": "integer",
            "minimum": 0,
            "maximum": 1000000000
          },
          "minimum_lot": {
            "type": "integer",
            "minimum": 0,
            "maximum": 1000000000
          },
          "truck_capacity": {
            "type": "integer",
            "minimum": 0,
            "maximum": 1000000000
          },
          "max_trucks": {
            "type": "integer",
            "minimum": 0,
            "maximum": 1000000000
          },
          "truck_cost": {
            "type": "integer",
            "minimum": 0,
            "maximum": 1000000000
          },
          "mode": {
            "enum": [
              "standard",
              "road",
              "rail"
            ]
          }
        },
        "required": [
          "id",
          "source",
          "destination",
          "products",
          "lead_time",
          "capacity",
          "unit_cost",
          "fixed_cost",
          "minimum_lot",
          "truck_capacity",
          "max_trucks",
          "truck_cost",
          "mode"
        ],
        "additionalProperties": false
      }
    },
    "recipes": {
      "type": "array",
      "items": {
        "type": "object",
        "properties": {
          "id": {
            "type": "string",
            "pattern": "^[A-Za-z][A-Za-z0-9_]*$"
          },
          "node": {
            "type": "string",
            "pattern": "^[A-Za-z][A-Za-z0-9_]*$"
          },
          "inputs": {
            "type": "array",
            "items": {
              "type": "object",
              "properties": {
                "product": {
                  "type": "string",
                  "pattern": "^[A-Za-z][A-Za-z0-9_]*$"
                },
                "quantity": {
                  "type": "integer",
                  "minimum": 1,
                  "maximum": 1000000000
                }
              },
              "required": [
                "product",
                "quantity"
              ],
              "additionalProperties": false
            },
            "minItems": 1
          },
          "output": {
            "type": "string",
            "pattern": "^[A-Za-z][A-Za-z0-9_]*$"
          },
          "output_quantity": {
            "type": "integer",
            "minimum": 1,
            "maximum": 1000000000
          },
          "capacity": {
            "type": "integer",
            "minimum": 1,
            "maximum": 1000000000
          },
          "cost": {
            "type": "integer",
            "minimum": 0,
            "maximum": 1000000000
          }
        },
        "required": [
          "id",
          "node",
          "inputs",
          "output",
          "output_quantity",
          "capacity",
          "cost"
        ],
        "additionalProperties": false
      }
    },
    "sourcing": {
      "type": "object",
      "properties": {
        "max_active_suppliers": {
          "anyOf": [
            {
              "type": "integer",
              "minimum": 1,
              "maximum": 1000000000
            },
            {
              "type": "null"
            }
          ]
        },
        "dependencies": {
          "type": "array",
          "items": {
            "type": "array",
            "items": {
              "type": "string",
              "pattern": "^[A-Za-z][A-Za-z0-9_]*$"
            },
            "minItems": 2,
            "maxItems": 2
          }
        }
      },
      "required": [
        "max_active_suppliers",
        "dependencies"
      ],
      "additionalProperties": false
    },
    "objective_constant": {
      "type": "integer",
      "minimum": 0,
      "maximum": 1000000000
    },
    "narrative_template": {
      "enum": [
        0,
        1,
        2
      ]
    }
  },
  "required": [
    "schema_version",
    "family",
    "structural_level",
    "features",
    "periods",
    "units",
    "products",
    "locations",
    "initial_stock",
    "demands",
    "routes",
    "recipes",
    "sourcing",
    "objective_constant",
    "narrative_template"
  ],
  "additionalProperties": false
}
