{
  "demands": [
    {
      "node": "M0",
      "period": 0,
      "product": "P0",
      "quantity": 5
    }
  ],
  "family": "F03",
  "features": [
    "transport",
    "bounded_inventory",
    "exact_demand",
    "warehouse_activation"
  ],
  "initial_stock": [
    {
      "age": 0,
      "node": "W0",
      "product": "P0",
      "quantity": 8
    }
  ],
  "locations": [
    {
      "id": "W0",
      "opening_cost": 25,
      "role": "warehouse",
      "storage_capacity": 7,
      "throughput_capacity": 5
    },
    {
      "id": "W1",
      "opening_cost": 13,
      "role": "warehouse",
      "storage_capacity": 3,
      "throughput_capacity": 2
    },
    {
      "id": "W2",
      "opening_cost": 7,
      "role": "warehouse",
      "storage_capacity": 2,
      "throughput_capacity": 3
    },
    {
      "id": "M0",
      "opening_cost": 0,
      "role": "market",
      "storage_capacity": 1,
      "throughput_capacity": 3
    }
  ],
  "narrative_template": 1,
  "objective_constant": 0,
  "periods": 1,
  "products": [
    {
      "disposal_cost": 0,
      "holding_cost": 0,
      "id": "P0",
      "shelf_life": null,
      "volume": 1
    }
  ],
  "recipes": [],
  "routes": [
    {
      "capacity": 8,
      "destination": "M0",
      "fixed_cost": 0,
      "id": "R_W0_M0_standard",
      "lead_time": 0,
      "max_trucks": 0,
      "minimum_lot": 0,
      "mode": "standard",
      "products": [
        "P0"
      ],
      "source": "W0",
      "truck_capacity": 0,
      "truck_cost": 0,
      "unit_cost": 12
    },
    {
      "capacity": 8,
      "destination": "M0",
      "fixed_cost": 0,
      "id": "R_W1_M0_standard",
      "lead_time": 0,
      "max_trucks": 0,
      "minimum_lot": 0,
      "mode": "standard",
      "products": [
        "P0"
      ],
      "source": "W1",
      "truck_capacity": 0,
      "truck_cost": 0,
      "unit_cost": 0
    }
  ],
  "schema_version": "1.0.0",
  "sourcing": {
    "dependencies": [],
    "max_active_suppliers": null
  },
  "structural_level": "L2",
  "units": {
    "capacity": "volume_unit",
    "currency": "cent",
    "production": "batch",
    "quantity": "item",
    "time": "period",
    "truck": "truck"
  }
}
